,alert_id,full_path,title,date
0,AA22-321A,https://www.cisa.gov/ncas/alerts/aa22-321a,#StopRansomware: Hive Ransomware,2022-11-17
1,AA22-320A,https://www.cisa.gov/ncas/alerts/aa22-320a,"Iranian Government-Sponsored APT Actors Compromise Federal Network, Deploy Crypto Miner, Credential Harvester",2022-11-16
2,AA22-294A,https://www.cisa.gov/ncas/alerts/aa22-294a,#StopRansomware: Daixin Team,2022-10-21
3,AA22-279A,https://www.cisa.gov/ncas/alerts/aa22-279a,Top CVEs Actively Exploited By People’s Republic of China State-Sponsored Cyber Actors,2022-10-06
4,AA22-277A,https://www.cisa.gov/ncas/alerts/aa22-277a,Impacket and Exfiltration Tool Used to Steal Sensitive Information from Defense Industrial Base Organization,2022-10-04
5,AA22-265A,https://www.cisa.gov/ncas/alerts/aa22-265a,Control System Defense: Know the Opponent,2022-09-22
6,AA22-264A,https://www.cisa.gov/ncas/alerts/aa22-264a,Iranian State Actors Conduct Cyber Operations Against the Government of Albania,2022-09-21
7,AA22-257A,https://www.cisa.gov/ncas/alerts/aa22-257a,Iranian Islamic Revolutionary Guard Corps-Affiliated Cyber Actors Exploiting Vulnerabilities for Data Extortion and Disk Encryption for Ransom Operations,2022-09-14
8,AA22-249A,https://www.cisa.gov/ncas/alerts/aa22-249a,#StopRansomware: Vice Society,2022-09-06
9,AA22-228A,https://www.cisa.gov/ncas/alerts/aa22-228a,Threat Actors Exploiting Multiple CVEs Against Zimbra Collaboration Suite,2022-08-16
10,AA22-223A,https://www.cisa.gov/ncas/alerts/aa22-223a,#StopRansomware: Zeppelin Ransomware,2022-08-11
11,AA22-216A,https://www.cisa.gov/ncas/alerts/aa22-216a,2021 Top Malware Strains,2022-08-04
12,AA22-187A,https://www.cisa.gov/ncas/alerts/aa22-187a,North Korean State-Sponsored Cyber Actors Use Maui Ransomware to Target the Healthcare and Public Health Sector ,2022-07-06
13,AA22-181A,https://www.cisa.gov/ncas/alerts/aa22-181a,#StopRansomware: MedusaLocker ,2022-06-30
14,AA22-174A,https://www.cisa.gov/ncas/alerts/aa22-174a,Malicious Cyber Actors Continue to Exploit Log4Shell in VMware Horizon Systems,2022-06-23
15,AA22-158A,https://www.cisa.gov/ncas/alerts/aa22-158a,People’s Republic of China State-Sponsored Cyber Actors Exploit Network Providers and Devices,2022-06-07
16,AA22-152A,https://www.cisa.gov/ncas/alerts/aa22-152a,Karakurt Data Extortion Group ,2022-06-01
17,AA22-138B,https://www.cisa.gov/ncas/alerts/aa22-138b,Threat Actors Chaining Unpatched VMware Vulnerabilities for Full System Control ,2022-05-18
18,AA22-138A,https://www.cisa.gov/ncas/alerts/aa22-138a,Threat Actors Exploiting F5 BIG-IP CVE-2022-1388,2022-05-18
19,AA22-137A,https://www.cisa.gov/ncas/alerts/aa22-137a,Weak Security Controls and Practices Routinely Exploited for Initial Access,2022-05-17
20,AA22-131A,https://www.cisa.gov/ncas/alerts/aa22-131a,Protecting Against Cyber Threats to Managed Service Providers and their Customers,2022-05-11
21,AA22-117A,https://www.cisa.gov/ncas/alerts/aa22-117a,2021 Top Routinely Exploited Vulnerabilities,2022-04-27
22,AA22-110A,https://www.cisa.gov/ncas/alerts/aa22-110a,Russian State-Sponsored and Criminal Cyber Threats to Critical Infrastructure,2022-04-20
23,AA22-108A,https://www.cisa.gov/ncas/alerts/aa22-108a,TraderTraitor: North Korean State-Sponsored APT Targets Blockchain Companies ,2022-04-18
24,AA22-103A,https://www.cisa.gov/ncas/alerts/aa22-103a,APT Cyber Tools Targeting ICS/SCADA Devices,2022-04-13
25,AA22-083A,https://www.cisa.gov/ncas/alerts/aa22-083a,"Tactics, Techniques, and Procedures of Indicted State-Sponsored Russian Cyber Actors Targeting the Energy Sector",2022-03-24
26,AA22-076A,https://www.cisa.gov/ncas/alerts/aa22-076a,Strengthening Cybersecurity of SATCOM Network Providers and Customers,2022-03-17
27,AA22-074A,https://www.cisa.gov/ncas/alerts/aa22-074a,Russian State-Sponsored Cyber Actors Gain Network Access by Exploiting Default Multifactor Authentication Protocols and “PrintNightmare” Vulnerability,2022-03-15
28,AA22-057A,https://www.cisa.gov/ncas/alerts/aa22-057a,Update: Destructive Malware Targeting Organizations in Ukraine,2022-02-26
29,AA22-055A,https://www.cisa.gov/ncas/alerts/aa22-055a,Iranian Government-Sponsored Actors Conduct Cyber Operations Against Global Government and Commercial Networks,2022-02-24
30,AA22-054A,https://www.cisa.gov/ncas/alerts/aa22-054a,New Sandworm Malware Cyclops Blink Replaces VPNFilter,2022-02-23
31,AA22-047A,https://www.cisa.gov/ncas/alerts/aa22-047a,Russian State-Sponsored Cyber Actors Target Cleared Defense Contractor Networks to Obtain Sensitive U.S. Defense Information and Technology,2022-02-16
32,AA22-040A,https://www.cisa.gov/ncas/alerts/aa22-040a,2021 Trends Show Increased Globalized Threat of Ransomware,2022-02-09
33,AA22-011A,https://www.cisa.gov/ncas/alerts/aa22-011a,Understanding and Mitigating Russian State-Sponsored Cyber Threats to U.S. Critical Infrastructure  ,2022-01-11
34,AA21-356A,https://www.cisa.gov/ncas/alerts/aa21-356a,Mitigating Log4Shell and Other Log4j-Related Vulnerabilities,2021-12-22
35,AA21-336A,https://www.cisa.gov/ncas/alerts/aa21-336a,APT Actors Exploiting CVE-2021-44077 in Zoho ManageEngine ServiceDesk Plus,2021-12-02
36,AA21-321A,https://www.cisa.gov/ncas/alerts/aa21-321a,Iranian Government-Sponsored APT Cyber Actors Exploiting Microsoft Exchange and Fortinet Vulnerabilities in Furtherance of Malicious Activities,2021-11-17
37,AA21-291A,https://www.cisa.gov/ncas/alerts/aa21-291a,BlackMatter Ransomware ,2021-10-18
38,AA21-287A,https://www.cisa.gov/ncas/alerts/aa21-287a,Ongoing Cyber Threats to U.S. Water and Wastewater Systems,2021-10-14
39,AA21-265A,https://www.cisa.gov/ncas/alerts/aa21-265a,Conti Ransomware,2021-09-22
40,AA21-259A,https://www.cisa.gov/ncas/alerts/aa21-259a,APT Actors Exploiting Newly Identified Vulnerability in ManageEngine ADSelfService Plus,2021-09-16
41,AA21-243A,https://www.cisa.gov/ncas/alerts/aa21-243a,Ransomware Awareness for Holidays and Weekends,2021-08-31
42,AA21-229A,https://www.cisa.gov/ncas/alerts/aa21-229a,BadAlloc Vulnerability Affecting BlackBerry QNX RTOS,2021-08-17
43,AA21-209A,https://www.cisa.gov/ncas/alerts/aa21-209a,Top Routinely Exploited Vulnerabilities,2021-07-28
44,AA21-201A,https://www.cisa.gov/ncas/alerts/aa21-201a,"Chinese Gas Pipeline Intrusion Campaign, 2011 to 2013 ",2021-07-20
45,AA21-200B,https://www.cisa.gov/ncas/alerts/aa21-200b,Chinese State-Sponsored Cyber Operations: Observed TTPs,2021-07-19
46,AA21-200A,https://www.cisa.gov/ncas/alerts/aa21-200a,"Tactics, Techniques, and Procedures of Indicted APT40 Actors Associated with China’s MSS Hainan State Security Department",2021-07-19
47,AA21-148A,https://www.cisa.gov/ncas/alerts/aa21-148a,"Sophisticated Spearphishing Campaign Targets Government Organizations, IGOs, and NGOs",2021-05-28
48,AA21-131A,https://www.cisa.gov/ncas/alerts/aa21-131a,DarkSide Ransomware: Best Practices for Preventing Business Disruption from Ransomware Attacks,2021-05-11
49,AA21-116A,https://www.cisa.gov/ncas/alerts/aa21-116a,Russian Foreign Intelligence Service (SVR) Cyber Operations: Trends and Best Practices for Network Defenders,2021-04-26
50,AA21-110A,https://www.cisa.gov/ncas/alerts/aa21-110a,Exploitation of Pulse Connect Secure Vulnerabilities,2021-04-20
51,AA21-077A,https://www.cisa.gov/ncas/alerts/aa21-077a,Detecting Post-Compromise Threat Activity Using the CHIRP IOC Detection Tool,2021-03-18
52,AA21-076A,https://www.cisa.gov/ncas/alerts/aa21-076a,TrickBot Malware,2021-03-17
53,AA21-062A,https://www.cisa.gov/ncas/alerts/aa21-062a,Mitigate Microsoft Exchange Server Vulnerabilities,2021-03-03
54,AA21-055A,https://www.cisa.gov/ncas/alerts/aa21-055a,Exploitation of Accellion File Transfer Appliance,2021-02-24
55,AA21-048A,https://www.cisa.gov/ncas/alerts/aa21-048a,AppleJeus: Analysis of North Korea’s Cryptocurrency Malware ,2021-02-17
56,AA21-042A,https://www.cisa.gov/ncas/alerts/aa21-042a,Compromise of U.S. Water Treatment Facility ,2021-02-11
57,AA21-008A,https://www.cisa.gov/ncas/alerts/aa21-008a,Detecting Post-Compromise Threat Activity in Microsoft Cloud Environments  ,2021-01-08
58,AA20-352A,https://www.cisa.gov/ncas/alerts/aa20-352a,"Advanced Persistent Threat Compromise of Government Agencies, Critical Infrastructure, and Private Sector Organizations",2020-12-17
59,AA20-345A,https://www.cisa.gov/ncas/alerts/aa20-345a,Cyber Actors Target K-12 Distance Learning Education to Cause Disruptions and Steal Data ,2020-12-10
60,AA20-336A,https://www.cisa.gov/ncas/alerts/aa20-336a,Advanced Persistent Threat Actors Targeting U.S. Think Tanks,2020-12-01
61,AA20-304A,https://www.cisa.gov/ncas/alerts/aa20-304a,Iranian Advanced Persistent Threat Actor Identified Obtaining Voter Registration Data,2020-10-30
62,AA20-302A,https://www.cisa.gov/ncas/alerts/aa20-302a,Ransomware Activity Targeting the Healthcare and Public Health Sector,2020-10-28
63,AA20-301A,https://www.cisa.gov/ncas/alerts/aa20-301a,North Korean Advanced Persistent Threat Focus: Kimsuky,2020-10-27
64,AA20-296B,https://www.cisa.gov/ncas/alerts/aa20-296b,Iranian Advanced Persistent Threat Actors Threaten Election-Related Systems,2020-10-22
65,AA20-296A,https://www.cisa.gov/ncas/alerts/aa20-296a,Russian State-Sponsored Advanced Persistent Threat Actor Compromises U.S. Government Targets,2020-10-22
66,AA20-283A,https://www.cisa.gov/ncas/alerts/aa20-283a,"APT Actors Chaining Vulnerabilities Against SLTT, Critical Infrastructure, and Elections Organizations",2020-10-09
67,AA20-280A,https://www.cisa.gov/ncas/alerts/aa20-280a,Emotet Malware,2020-10-06
68,AA20-275A,https://www.cisa.gov/ncas/alerts/aa20-275a,Potential for China Cyber Response to Heightened U.S.–China Tensions,2020-10-01
69,AA20-266A,https://www.cisa.gov/ncas/alerts/aa20-266a,LokiBot Malware ,2020-09-22
70,AA20-259A,https://www.cisa.gov/ncas/alerts/aa20-259a,Iran-Based Threat Actor Exploits VPN Vulnerabilities,2020-09-15
71,AA20-258A,https://www.cisa.gov/ncas/alerts/aa20-258a,Chinese Ministry of State Security-Affiliated Cyber Threat Actor Activity,2020-09-14
72,AA20-245A,https://www.cisa.gov/ncas/alerts/aa20-245a,Technical Approaches to Uncovering and Remediating Malicious Activity,2020-09-01
73,AA20-239A,https://www.cisa.gov/ncas/alerts/aa20-239a,FASTCash 2.0: North Korea's BeagleBoyz Robbing Banks,2020-08-26
74,AA20-227A,https://www.cisa.gov/ncas/alerts/aa20-227a,Phishing Emails Used to Deploy KONNI Malware,2020-08-14
75,AA20-225A,https://www.cisa.gov/ncas/alerts/aa20-225a,Malicious Cyber Actor Spoofing COVID-19 Loan Relief Webpage via Phishing Emails,2020-08-12
76,AA20-209A,https://www.cisa.gov/ncas/alerts/aa20-209a,Potential Legacy Risk from Malware Targeting QNAP NAS Devices,2020-07-27
77,AA20-206A,https://www.cisa.gov/ncas/alerts/aa20-206a,Threat Actor Exploitation of F5 BIG-IP CVE-2020-5902   ,2020-07-24
78,AA20-205A,https://www.cisa.gov/ncas/alerts/aa20-205a,NSA and CISA Recommend Immediate Actions to Reduce Exposure Across Operational Technologies and Control Systems,2020-07-23
79,AA20-198A,https://www.cisa.gov/ncas/alerts/aa20-198a,Malicious Cyber Actor Use of Network Tunneling and Spoofing to Obfuscate Geolocation,2020-07-16
80,AA20-195A,https://www.cisa.gov/ncas/alerts/aa20-195a,Critical Vulnerability in SAP NetWeaver AS Java,2020-07-13
81,AA20-183A,https://www.cisa.gov/ncas/alerts/aa20-183a,Defending Against Malicious Cyber Activity Originating from Tor ,2020-07-01
82,AA20-182A,https://www.cisa.gov/ncas/alerts/aa20-182a,EINSTEIN Data Trends – 30-day Lookback ,2020-06-30
83,AA20-133A,https://www.cisa.gov/ncas/alerts/aa20-133a,Top 10 Routinely Exploited Vulnerabilities,2020-05-12
84,AA20-126A,https://www.cisa.gov/ncas/alerts/aa20-126a,APT Groups Target Healthcare and Essential Services,2020-05-05
85,AA20-120A,https://www.cisa.gov/ncas/alerts/aa20-120a,Microsoft Office 365 Security Recommendations ,2020-04-29
86,AA20-107A,https://www.cisa.gov/ncas/alerts/aa20-107a,Continued Threat Actor Exploitation Post Pulse Secure VPN Patching,2020-04-16
87,AA20-106A,https://www.cisa.gov/ncas/alerts/aa20-106a,Guidance on the North Korean Cyber Threat,2020-04-15
88,AA20-099A,https://www.cisa.gov/ncas/alerts/aa20-099a,COVID-19 Exploited by Malicious Cyber Actors,2020-04-08
89,AA20-073A,https://www.cisa.gov/ncas/alerts/aa20-073a,Enterprise VPN Security,2020-03-13
90,AA20-049A,https://www.cisa.gov/ncas/alerts/aa20-049a,Ransomware Impacting Pipeline Operations  ,2020-02-18
91,AA20-031A,https://www.cisa.gov/ncas/alerts/aa20-031a,Detecting Citrix CVE-2019-19781,2020-01-31
92,AA20-020A,https://www.cisa.gov/ncas/alerts/aa20-020a,"Critical Vulnerability in Citrix Application Delivery Controller, Gateway, and SD-WAN WANOP ",2020-01-20
93,AA20-014A,https://www.cisa.gov/ncas/alerts/aa20-014a,Critical Vulnerabilities in Microsoft Windows Operating Systems,2020-01-14
94,AA20-010A,https://www.cisa.gov/ncas/alerts/aa20-010a,Continued Exploitation of Pulse Secure VPN Vulnerability,2020-01-10
95,AA20-006A,https://www.cisa.gov/ncas/alerts/aa20-006a,Potential for Iranian Cyber Response to U.S. Military Strike in Baghdad,2020-01-06
96,AA19-339A,https://www.cisa.gov/ncas/alerts/aa19-339a,Dridex Malware,2019-12-05
97,AA19-290A,https://www.cisa.gov/ncas/alerts/aa19-290a,Microsoft Ending Support for Windows 7 and Windows Server 2008 R2,2019-10-17
98,AA19-168A,https://www.cisa.gov/ncas/alerts/AA19-168A,Microsoft Operating Systems BlueKeep Vulnerability,2019-06-17
99,AA19-122A,https://www.cisa.gov/ncas/alerts/AA19-122A,New Exploits for Unsecure SAP Systems,2019-05-02
100,AA19-024A,https://www.cisa.gov/ncas/alerts/AA19-024A,DNS Infrastructure Hijacking Campaign,2019-01-24
101,AA18-337A,https://www.cisa.gov/ncas/alerts/AA18-337A,SamSam Ransomware,2018-12-03
102,TA18-331A,https://www.cisa.gov/ncas/alerts/TA18-331A,3ve – Major Online Ad Fraud Operation,2018-11-27
103,AA18-284A,https://www.cisa.gov/ncas/alerts/AA18-284A,Publicly Available Tools Seen in Cyber Incidents Worldwide,2018-10-11
104,TA18-276B,https://www.cisa.gov/ncas/alerts/TA18-276B,Advanced Persistent Threat Activity Exploiting Managed Service Providers,2018-10-03
105,TA18-276A,https://www.cisa.gov/ncas/alerts/TA18-276A,Using Rigorous Credential Control to Mitigate Trusted Network Exploitation,2018-10-03
106,TA18-275A,https://www.cisa.gov/ncas/alerts/TA18-275A,HIDDEN COBRA – FASTCash Campaign,2018-10-02
107,TA18-201A,https://www.cisa.gov/ncas/alerts/TA18-201A,Emotet Malware,2018-07-20
108,TA18-149A,https://www.cisa.gov/ncas/alerts/TA18-149A,HIDDEN COBRA – Joanap Backdoor Trojan and Brambul Server Message Block Worm,2018-05-29
109,TA18-145A,https://www.cisa.gov/ncas/alerts/TA18-145A,Cyber Actors Target Home and Office Routers and Networked Devices Worldwide,2018-05-25
110,TA18-141A,https://www.cisa.gov/ncas/alerts/TA18-141A,Side-Channel Vulnerability Variants 3a and 4,2018-05-21
111,TA18-106A,https://www.cisa.gov/ncas/alerts/TA18-106A,Russian State-Sponsored Cyber Actors Targeting Network Infrastructure Devices,2018-04-16
112,TA18-086A,https://www.cisa.gov/ncas/alerts/TA18-086A,Brute Force Attacks Conducted by Cyber Actors ,2018-03-27
113,TA18-074A,https://www.cisa.gov/ncas/alerts/TA18-074A,Russian Government Cyber Activity Targeting Energy and Other Critical Infrastructure Sectors,2018-03-15
114,TA18-004A,https://www.cisa.gov/ncas/alerts/TA18-004A,Meltdown and Spectre Side-Channel Vulnerability Guidance,2018-01-04
115,TA17-318B,https://www.cisa.gov/ncas/alerts/TA17-318B,HIDDEN COBRA – North Korean Trojan: Volgmer,2017-11-14
116,TA17-318A,https://www.cisa.gov/ncas/alerts/TA17-318A,HIDDEN COBRA – North Korean Remote Administration Tool: FALLCHILL,2017-11-14
117,TA17-293A,https://www.cisa.gov/ncas/alerts/TA17-293A,Advanced Persistent Threat Activity Targeting Energy and Other Critical Infrastructure Sectors,2017-10-20
118,TA17-181A,https://www.cisa.gov/ncas/alerts/TA17-181A,Petya Ransomware ,2017-07-01
119,TA17-164A,https://www.cisa.gov/ncas/alerts/TA17-164A,HIDDEN COBRA – North Korea’s DDoS Botnet Infrastructure,2017-06-13
120,TA17-163A,https://www.cisa.gov/ncas/alerts/TA17-163A,CrashOverride Malware,2017-06-12
121,TA17-156A,https://www.cisa.gov/ncas/alerts/TA17-156A,Reducing the Risk of SNMP Abuse,2017-06-05
122,TA17-132A,https://www.cisa.gov/ncas/alerts/TA17-132A,Indicators Associated With WannaCry Ransomware,2017-05-12
123,TA17-117A,https://www.cisa.gov/ncas/alerts/TA17-117A,Intrusions Affecting Multiple Victims Across Multiple Sectors,2017-04-27
124,TA17-075A,https://www.cisa.gov/ncas/alerts/TA17-075A,HTTPS Interception Weakens TLS Security,2017-03-16
125,TA16-336A,https://www.cisa.gov/ncas/alerts/TA16-336A,Avalanche (crimeware-as-a-service infrastructure),2016-12-01
126,TA16-288A,https://www.cisa.gov/ncas/alerts/TA16-288A,Heightened DDoS Threat Posed by Mirai and Other Botnets,2016-10-14
127,TA16-250A,https://www.cisa.gov/ncas/alerts/TA16-250A,The Increasing Threat to Network Infrastructure Devices and Recommended Mitigations,2016-09-06
128,TA16-187A,https://www.cisa.gov/ncas/alerts/TA16-187A,Symantec and Norton Security Products Contain Critical Vulnerabilities,2016-07-05
129,TA16-144A,https://www.cisa.gov/ncas/alerts/TA16-144A,WPAD Name Collision Vulnerability,2016-05-23
130,TA16-132A,https://www.cisa.gov/ncas/alerts/TA16-132A,Exploitation of SAP Business Applications,2016-05-11
131,TA16-105A,https://www.cisa.gov/ncas/alerts/TA16-105A,Apple Ends Support for QuickTime for Windows; New Vulnerabilities Announced,2016-04-14
132,TA16-091A,https://www.cisa.gov/ncas/alerts/TA16-091A,Ransomware and Recent Variants,2016-03-31
133,TA15-337A,https://www.cisa.gov/ncas/alerts/TA15-337A,Dorkbot,2015-12-03
134,TA15-314A,https://www.cisa.gov/ncas/alerts/TA15-314A,Compromised Web Servers and Web Shells - Threat Awareness and Guidance ,2015-11-10
135,TA15-286A,https://www.cisa.gov/ncas/alerts/TA15-286A,Dridex P2P Malware,2015-10-13
136,TA15-240A,https://www.cisa.gov/ncas/alerts/TA15-240A,Controlling Outbound DNS Access,2015-08-28
137,TA15-213A,https://www.cisa.gov/ncas/alerts/TA15-213A,Recent Email Phishing Campaigns – Mitigation and Response Recommendations,2015-08-01
138,TA15-195A,https://www.cisa.gov/ncas/alerts/TA15-195A,Adobe Flash and Microsoft Windows Vulnerabilities,2015-07-14
139,TA15-120A,https://www.cisa.gov/ncas/alerts/TA15-120A,Securing End-to-End Communications,2015-04-30
140,TA15-119A,https://www.cisa.gov/ncas/alerts/TA15-119A,Top 30 Targeted High Risk Vulnerabilities,2015-04-29
141,TA15-105A,https://www.cisa.gov/ncas/alerts/TA15-105A,Simda Botnet,2015-04-15
142,TA15-103A,https://www.cisa.gov/ncas/alerts/TA15-103A,DNS Zone Transfer AXFR Requests May Leak Domain Information,2015-04-13
143,TA15-098A,https://www.cisa.gov/ncas/alerts/TA15-098A,AAEH,2015-04-09
144,TA15-051A,https://www.cisa.gov/ncas/alerts/TA15-051A,Lenovo Superfish Adware Vulnerable to HTTPS Spoofing,2015-02-20
145,TA14-353A,https://www.cisa.gov/ncas/alerts/TA14-353A,Targeted Destructive Malware,2014-12-19
146,TA14-329A,https://www.cisa.gov/ncas/alerts/TA14-329A,Regin Malware,2014-11-25
147,TA14-323A,https://www.cisa.gov/ncas/alerts/TA14-323A,Microsoft Windows Kerberos KDC Remote Privilege Escalation Vulnerability ,2014-11-19
148,TA14-318B,https://www.cisa.gov/ncas/alerts/TA14-318B,Microsoft Windows OLE Automation Array Remote Code Execution Vulnerability ,2014-11-14
149,TA14-318A,https://www.cisa.gov/ncas/alerts/TA14-318A,Microsoft Secure Channel (Schannel) Vulnerability (CVE-2014-6321) ,2014-11-14
150,TA14-317A,https://www.cisa.gov/ncas/alerts/TA14-317A,Apple iOS 'Masque Attack' Technique,2014-11-13
151,TA14-310A,https://www.cisa.gov/ncas/alerts/TA14-310A,Microsoft Ending Support for Windows Server 2003 Operating System,2014-11-10
152,TA14-300A,https://www.cisa.gov/ncas/alerts/TA14-300A,Phishing Campaign Linked with “Dyre” Banking Malware,2014-10-27
153,TA14-295A,https://www.cisa.gov/ncas/alerts/TA14-295A,Crypto Ransomware,2014-10-22
154,TA14-290A,https://www.cisa.gov/ncas/alerts/TA14-290A,SSL 3.0 Protocol Vulnerability and POODLE Attack,2014-10-17
155,TA14-268A,https://www.cisa.gov/ncas/alerts/TA14-268A,"GNU Bourne-Again Shell (Bash) ‘Shellshock’ Vulnerability (CVE-2014-6271, CVE-2014-7169, CVE-2014-7186, CVE-2014-7187, CVE-2014-6277 and CVE 2014-6278) ",2014-09-25
156,TA14-212A,https://www.cisa.gov/ncas/alerts/TA14-212A,Backoff Point-of-Sale Malware,2014-07-31
157,TA14-150A,https://www.cisa.gov/ncas/alerts/TA14-150A,GameOver Zeus P2P Malware,2014-06-02
158,TA14-098A,https://www.cisa.gov/ncas/alerts/TA14-098A,OpenSSL 'Heartbleed' vulnerability (CVE-2014-0160),2014-04-08
159,TA14-069A,https://www.cisa.gov/ncas/alerts/TA14-069A-0,Microsoft Ending Support for Windows XP and Office 2003,2014-03-10
160,TA14-017A,https://www.cisa.gov/ncas/alerts/TA14-017A,UDP-Based Amplification Attacks,2014-01-17
161,TA14-013A,https://www.cisa.gov/ncas/alerts/TA14-013A,NTP Amplification Attacks Using CVE-2013-5211,2014-01-13
162,TA14-002A,https://www.cisa.gov/ncas/alerts/TA14-002A,Malware Targeting Point of Sale Systems,2014-01-02
163,TA13-317A,https://www.cisa.gov/ncas/alerts/TA13-317A,Microsoft Updates for Multiple Vulnerabilities,2013-11-13
164,TA13-309A,https://www.cisa.gov/ncas/alerts/TA13-309A,CryptoLocker Ransomware Infections,2013-11-05
165,TA13-288A,https://www.cisa.gov/ncas/alerts/TA13-288A,Microsoft Updates for Multiple Vulnerabilities,2013-10-15
166,TA13-253A,https://www.cisa.gov/ncas/alerts/TA13-253A,Microsoft Updates for Multiple Vulnerabilities,2013-09-10
167,TA13-225A,https://www.cisa.gov/ncas/alerts/TA13-225A,Microsoft Updates for Multiple Vulnerabilities,2013-08-13
168,TA13-207A,https://www.cisa.gov/ncas/alerts/TA13-207A,Risks of Using the Intelligent Platform Management Interface (IPMI),2013-07-26
169,TA13-193A,https://www.cisa.gov/ncas/alerts/TA13-193A,Exploit Tool Targets Vulnerabilities in McAfee ePolicy Orchestrator (ePO),2013-07-12
170,TA13-190A,https://www.cisa.gov/ncas/alerts/TA13-190A,Microsoft Updates for Multiple Vulnerabilities,2013-07-09
171,TA13-175A,https://www.cisa.gov/ncas/alerts/TA13-175A,Risks of Default Passwords on the Internet,2013-06-24
172,TA13-169A,https://www.cisa.gov/ncas/alerts/TA13-169A,Oracle Releases Updates for Javadoc and Other Java SE Vulnerabilities,2013-06-18
173,TA13-168A,https://www.cisa.gov/ncas/alerts/TA13-168A,Microsoft Updates for Multiple Vulnerabilities,2013-06-17
174,TA13-141A,https://www.cisa.gov/ncas/alerts/TA13-141A,"Washington, DC Radio Station Web Site Compromises",2013-05-20
175,TA13-134A,https://www.cisa.gov/ncas/alerts/TA13-134A,Microsoft Updates for Multiple Vulnerabilities,2013-05-14
176,TA13-107A,https://www.cisa.gov/ncas/alerts/TA13-107A,Oracle Has Released Multiple Updates for Java SE,2013-04-17
177,TA13-100A,https://www.cisa.gov/ncas/alerts/TA13-100A,Microsoft Updates for Multiple Vulnerabilities,2013-04-10
178,TA13-088A,https://www.cisa.gov/ncas/alerts/TA13-088A,DNS Amplification Attacks,2013-03-29
179,TA13-071A,https://www.cisa.gov/ncas/alerts/TA13-071A,Microsoft Updates for Multiple Vulnerabilities,2013-03-12
180,TA13-064A,https://www.cisa.gov/ncas/alerts/TA13-064A,Oracle Java Contains Multiple Vulnerabilities,2013-03-05
181,TA13-051A,https://www.cisa.gov/ncas/alerts/TA13-051A,Oracle Java Multiple Vulnerabilities,2013-02-20
182,TA13-043B,https://www.cisa.gov/ncas/alerts/TA13-043B,Microsoft Updates for Multiple Vulnerabilities,2013-02-12
183,TA13-043A,https://www.cisa.gov/ncas/alerts/TA13-043A,Adobe Updates for Multiple Vulnerabilities,2013-02-12
184,TA13-032A,https://www.cisa.gov/ncas/alerts/TA13-032A,Oracle Java Multiple Vulnerabilities,2013-02-01
185,TA13-024A,https://www.cisa.gov/ncas/alerts/TA13-024A,Content Management Systems Security and Associated Risks,2013-01-24
186,TA13-015A,https://www.cisa.gov/ncas/alerts/TA13-015A,Microsoft Releases Update for Internet Explorer Vulnerability CVE-2012-4792,2013-01-15
187,TA13-010A,https://www.cisa.gov/ncas/alerts/TA13-010A,Oracle Java 7 Security Manager Bypass Vulnerability,2013-01-10
188,TA13-008A,https://www.cisa.gov/ncas/alerts/TA13-008A,Microsoft Updates for Multiple Vulnerabilities,2013-01-08
189,TA12-346A,https://www.cisa.gov/ncas/alerts/TA12-346A,Microsoft Updates for Multiple Vulnerabilities,2012-12-12
190,TA12-318A,https://www.cisa.gov/ncas/alerts/TA12-318A,Microsoft Updates for Multiple Vulnerabilities,2012-11-13
191,TA12-283A,https://www.cisa.gov/ncas/alerts/TA12-283A,Microsoft Updates for Multiple Vulnerabilities,2012-10-09
192,TA12-265A,https://www.cisa.gov/ncas/alerts/TA12-265A,Microsoft Releases Patch for Internet Explorer Exploit,2012-09-21
193,TA12-262A,https://www.cisa.gov/ncas/alerts/TA12-262A,Microsoft Security Advisory for Internet Explorer Exploit,2012-09-18
194,TA12-255A,https://www.cisa.gov/ncas/alerts/TA12-255A,Microsoft Updates for Multiple Vulnerabilities,2012-09-11
195,TA12-251A,https://www.cisa.gov/ncas/alerts/TA12-251A,Microsoft Update For Minimum Certificate Key Length,2012-09-07
196,TA12-240A,https://www.cisa.gov/ncas/alerts/TA12-240A,Oracle Java 7 Security Manager Bypass Vulnerability,2012-08-27
197,TA12-227A,https://www.cisa.gov/ncas/alerts/TA12-227A,Microsoft Updates for Multiple Vulnerabilities,2012-08-14
198,TA12-192A,https://www.cisa.gov/ncas/alerts/TA12-192A,Microsoft Updates for Multiple Vulnerabilities,2012-07-10
199,TA12-174A,https://www.cisa.gov/ncas/alerts/TA12-174A,Microsoft XML Core Services Attack Activity,2012-06-22
200,TA12-164A,https://www.cisa.gov/ncas/alerts/TA12-164A,Microsoft Updates for Multiple Vulnerabilities,2012-06-12
201,TA12-129A,https://www.cisa.gov/ncas/alerts/TA12-129A,Microsoft Updates for Multiple Vulnerabilities,2012-05-08
202,TA12-101B,https://www.cisa.gov/ncas/alerts/TA12-101B,Adobe Reader and Acrobat Security Updates and Architectural Improvements,2012-04-10
203,TA12-101A,https://www.cisa.gov/ncas/alerts/TA12-101A,Microsoft Updates for Multiple Vulnerabilities,2012-04-10
204,TA12-073A,https://www.cisa.gov/ncas/alerts/TA12-073A,Microsoft Updates for Multiple Vulnerabilities,2012-03-13
205,TA12-045A,https://www.cisa.gov/ncas/alerts/TA12-045A,Microsoft Updates for Multiple Vulnerabilities,2012-02-14
